slug,provider,offer,actionButtons,toolType,tag,price,planType,planName,description,starred
arweave,Arweave,,"[""[Website](https://arweave.org/)"",""[Docs](https://docs.arweave.org/developers)""]",Storage,"[""Permanent storage"",""Decentralized""]",Custom,Pay-As-You-Go,,"Permanent decentralized data storage protocol using a blockchain structure to incentivize indefinite storage of data",FALSE
dolpin-arctic,Dolpin,,"[""[Website](https://dolpin.io/)""]",Storage,"[""Permanent storage"",""Decentralized""]",$100/mo,Tiered,Arctic,"It is a decentralized & encrypted storage layer built with IPFS / Filecoin",FALSE
dolpin-fishbowl,Dolpin,,"[""[Website](https://dolpin.io/)""]",Storage,"[""Permanent storage"",""Decentralized""]",$20/mo,Tiered,Fishbowl,"It is a decentralized & encrypted storage layer built with IPFS / Filecoin",FALSE
dolpin-free,Dolpin,,"[""[Website](https://dolpin.io/)""]",Storage,"[""Permanent storage"",""Decentralized""]",$0,Free,,"It is a decentralized & encrypted storage layer built with IPFS / Filecoin",FALSE
irys,Irys,,"[""[Website](https://irys.xyz/)"",""[Docs](https://docs.irys.xyz/)""]",Storage,"[""Arweave"",""Permanent storage"",""Data provenance"",""Pay-per-use""]",Custom,Pay-As-You-Go,,"Programmable datachain enabling permanent on-chain data storage with verifiable provenance and instant access, designed for AI and large-scale data applications",FALSE
lighthouse,Lighthouse,,"[""[Website](https://www.lighthouse.storage/)"",""[Docs](https://docs.lighthouse.storage/)""]",Storage,"[""IPFS"",""Filecoin"",""Encryption"",""Permanent storage""]",$0,Freemium,,"Permanent decentralized storage powered by IPFS and Filecoin with a free 5 GB tier, encryption, token-gated access control, and dedicated IPFS gateways",FALSE
pinata,Pinata,,"[""[Website](https://pinata.cloud/)"",""[Docs](https://docs.pinata.cloud/)""]",Storage,"[""IPFS"",""Pinning service""]",$0,Free,,"IPFS pinning and file storage service trusted by 600,000+ developers with plans from free to enterprise",FALSE
storacha,Storacha,,"[""[Website](https://storacha.network/)"",""[Docs](https://docs.storacha.network/)""]",Storage,"[""IPFS"",""Filecoin"",""Decentralized"",""Hot storage""]",$0,Free,,"Decentralized hot storage network built on IPFS and Filecoin with petabyte-scale throughput and verifiable content-addressed data, evolved from web3.storage",FALSE
swarm,Swarm,,"[""[Website](https://www.ethswarm.org/)"",""[Docs](https://docs.ethswarm.org/docs/)""]",Storage,"[""Decentralized"",""P2P storage""]",Custom,Pay-As-You-Go,,"Decentralized P2P storage and communication infrastructure for building censorship-resistant serverless dapps",FALSE
