slug,provider,actionButtons,toolType,programmingLanguage,tag,description,planType,planName,price,trial,starred,dependencies,latestKnownVersion,latestKnownReleaseDate,maintainer,license
foundry,!provider:foundry,,,,,,,,,,,,,,,
hardhat,!provider:hardhat,,,,,,,,,,,,,,,
ape-framework,Ape,"[""[Docs](https://docs.apeworx.io/ape/stable/)""]",Framework,Python,"[""Python"",""Testing"",""Scripting""]","A Python-based smart contract development framework for the Ethereum ecosystem",Free,,$0,FALSE,FALSE,,TBD,TBD,TBD,TBD
scaffold-eth-2,Scaffold-ETH 2,"[""[Docs](https://docs.scaffoldeth.io/)""]",Framework,TypeScript,"[""React"",""Boilerplate"",""NextJS""]","An open-source toolkit for building decentralized applications on the Ethereum blockchain",Free,,$0,FALSE,FALSE,,TBD,TBD,TBD,TBD
vyper,!provider:vyper,,,,,,,,,,,,,,,
huff,!provider:huff,,,,,,,,,,,,,,,
wake,!provider:wake,,,,,,,,,,,,,,,
remix-project,Remix IDE,"[""[Docs](https://remix-ide.readthedocs.io/en/latest/)""]",Framework,Solidity,"[""Browser IDE"",""Learning"",""Prototyping""]","No-setup browser-based IDE for writing and deploying smart contracts immediately",Free,,$0,FALSE,FALSE,,TBD,TBD,TBD,TBD
ethers-js,!provider:ethers-js,,,,,,,,,,,,,,,
web3-js,!provider:web3-js,,,,,,,,,,,,,,,
web3-py,!provider:web3-py,,,,,,,,,,,,,,,
viem,Viem,"[""[Docs](https://viem.sh/docs/getting-started.html)""]",Library,TypeScript,"[""Performance"",""Low-level"",""Interaction""]","A TypeScript-first interface for EVM that provides low-level stateless primitives",Free,,$0,FALSE,FALSE,,TBD,TBD,TBD,TBD
wagmi,!provider:wagmi,,,,,,,,,,,,,,,
abitype,ABIType,"[""[Docs](https://abitype.dev/)""]",Library,TypeScript,"[""Types"",""ABI"",""Utilities""]","Strict TypeScript types for Ethereum ABIs",Free,,$0,FALSE,FALSE,,TBD,TBD,TBD,TBD
multicall-sdk,Multicall,"[""[Docs](https://github.com/makerdao/multicall)""]",Library,Solidity,"[""Optimization"",""Batching""]","Aggregate results from multiple contract reads into a single JSON-RPC request",Free,,$0,FALSE,FALSE,,TBD,TBD,TBD,TBD
walletconnect,!provider:walletconnect,,,,,,,,,,,,,,,
web3modal,Web3Modal,"[""[Docs](https://docs.walletconnect.com/web3modal/about)""]",SDK,TypeScript,"[""UI"",""Onboarding"",""WalletConnect""]","A versatile library for connecting users to your dApp with a simple UI",Free,,$0,FALSE,FALSE,,TBD,TBD,TBD,TBD
rainbowkit,!provider:rainbowkit,,,,,,,,,,,,,,,
connectkit,!provider:connectkit,,,,,,,,,,,,,,,
privy-sdk,Privy,"[""[Docs](https://docs.privy.io/)""]",SDK,TypeScript,"[""Auth"",""Embedded Wallets""]","Simple library to onboard all your users to Web3 with embedded wallets",Pay-as-you-go,,Custom,FALSE,FALSE,,TBD,TBD,TBD,TBD
dynamic-xyz,Dynamic,"[""[Docs](https://docs.dynamic.xyz/)""]",SDK,TypeScript,"[""Auth"",""Multi-chain""]","A powerful multi-chain wallet authentication and authorization platform",Pay-as-you-go,,Custom,FALSE,FALSE,,TBD,TBD,TBD,TBD
web3auth,!provider:web3auth-free,,,,,,,,,,,,,,,
particle-network-sdk,Particle Network,"[""[Docs](https://docs.particle.network/)""]",SDK,JavaScript,"[""Wallet-as-a-Service"",""Auth""]","Full-stack infrastructure for Web3, including Wallet-as-a-Service and Account Abstraction",Pay-as-you-go,,Custom,FALSE,FALSE,,TBD,TBD,TBD,TBD
magic-sdk,!provider:magic,,,,,,,,,,,,,,,
onboard-js,Web3 Onboard,"[""[Docs](https://onboard.blocknative.com/docs/overview)""]",SDK,JavaScript,"[""UI"",""Wallets""]","The open-source library for connecting wallets to dApps",Free,,$0,FALSE,FALSE,,TBD,TBD,TBD,TBD
turnkey-sdk,!provider:turnkey-free,,,,,,,,,,,,,,,
opbnb-sdk,opBNB SDK,"[""[Docs](https://docs.bnbchain.org/opbnb-docs/)""]",SDK,TypeScript,"[""L2"",""Scaling""]","SDK for interacting with the opBNB Layer 2 solution",Free,,$0,FALSE,FALSE,,TBD,TBD,TBD,TBD
bnb-greenfield-sdk,BNB Greenfield SDK,"[""[Docs](https://docs.bnbchain.org/bnb-greenfield/for-developers/apis-and-sdks/)""]",SDK,JavaScript,"[""Storage"",""Data""]","Official SDK for interacting with BNB Greenfield decentralized storage",Free,,$0,FALSE,FALSE,,TBD,TBD,TBD,TBD
nodereal-sdk,NodeReal,"[""[Docs](https://docs.nodereal.io/docs/meganode-api-overview)""]",SDK,JavaScript,"[""RPC"",""API""]","High-performance RPC and API provider for BSC",Pay-as-you-go,,Custom,FALSE,FALSE,,TBD,TBD,TBD,TBD
ankr-sdk,Ankr SDK,"[""[Docs](https://www.ankr.com/docs/)""]",SDK,JavaScript,"[""RPC"",""Infrastructure""]","Web3 infrastructure and RPC provider SDK",Pay-as-you-go,,Custom,FALSE,FALSE,,TBD,TBD,TBD,TBD
alchemy-sdk,!provider:alchemy-sdk-free,,,,,,,,,,,,,,,
quicknode-sdk,!provider:quicknode-sdk-free,,,,,,,,,,,,,,,
chainstack-sdk,Chainstack,"[""[Docs](https://docs.chainstack.com/)""]",SDK,JavaScript,"[""RPC"",""Nodes""]","Managed blockchain services and infrastructure SDK",Pay-as-you-go,,Custom,FALSE,FALSE,,TBD,TBD,TBD,TBD
getblock-sdk,GetBlock,"[""[Docs](https://getblock.io/docs/)""]",SDK,JavaScript,"[""RPC"",""Nodes""]","RPC node provider for 50+ blockchains including BSC",Pay-as-you-go,,Custom,FALSE,FALSE,,TBD,TBD,TBD,TBD
tatum-sdk,!provider:tatum-sdk-free,,,,,,,,,,,,,,,
lavanet-sdk,Lava Network,"[""[Docs](https://docs.lavanet.xyz/)""]",SDK,TypeScript,"[""RPC"",""Decentralized""]","Modular data access layer for blockchain data",Free,,$0,FALSE,FALSE,,TBD,TBD,TBD,TBD
infura-sdk,Infura,"[""[Docs](https://docs.infura.io/infura/)""]",SDK,JavaScript,"[""RPC"",""Archive""]","The original infrastructure provider for Ethereum and EVM chains",Pay-as-you-go,,Custom,FALSE,FALSE,,TBD,TBD,TBD,TBD
thegraph-sdk,The Graph,"[""[Docs](https://thegraph.com/docs/en/)""]",SDK,TypeScript,"[""Indexing"",""Query""]","Decentralized protocol for indexing and querying blockchain data",Free,,$0,FALSE,FALSE,,TBD,TBD,TBD,TBD
goldsky-sdk,Goldsky,"[""[Docs](https://docs.goldsky.com/)""]",SDK,TypeScript,"[""Indexing"",""Real-time""]","Real-time data indexing and streaming for crypto",Pay-as-you-go,,Custom,FALSE,FALSE,,TBD,TBD,TBD,TBD
envio-sdk,Envio,"[""[Docs](https://docs.envio.dev/)""]",SDK,TypeScript,"[""Indexing"",""Real-time""]","A modern, fast, and flexible blockchain indexer",Free,,$0,FALSE,FALSE,,TBD,TBD,TBD,TBD
subsquid-sdk,Subsquid,"[""[Docs](https://docs.subsquid.io/)""]",SDK,TypeScript,"[""Indexing"",""Data Lake""]","A peer-to-peer indexer and query engine for Web3",Free,,$0,FALSE,FALSE,,TBD,TBD,TBD,TBD
covalent-sdk,Covalent,"[""[Docs](https://www.covalenthq.com/docs/api/)""]",SDK,TypeScript,"[""Data"",""History""]","Unified API for historical blockchain data",Pay-as-you-go,,Custom,FALSE,FALSE,,TBD,TBD,TBD,TBD
bitquery-sdk,Bitquery,"[""[Docs](https://docs.bitquery.io/)""]",SDK,JavaScript,"[""Data"",""Analytics""]","Indexed blockchain data APIs",Pay-as-you-go,,Custom,FALSE,FALSE,,TBD,TBD,TBD,TBD
subquery-sdk,SubQuery,"[""[Docs](https://academy.subquery.network/)""]",SDK,TypeScript,"[""Indexing"",""Data""]","Data indexing toolkit for Polkadot and EVM chains",Free,,$0,FALSE,FALSE,,TBD,TBD,TBD,TBD
chainbase-sdk,!provider:chainbase-sdk-free,,,,,,,,,,,,,,,
moralis-sdk,Moralis,"[""[Docs](https://docs.moralis.io/)""]",SDK,JavaScript,"[""Data"",""API""]","Enterprise-grade Web3 APIs",Pay-as-you-go,,Custom,FALSE,FALSE,,TBD,TBD,TBD,TBD
messari-sdk,Messari,"[""[Docs](https://messari.io/api/docs)""]",SDK,Python,"[""Data"",""Research""]","Crypto market intelligence and data",Pay-as-you-go,,Custom,FALSE,FALSE,,TBD,TBD,TBD,TBD
pyth-sdk,Pyth Network,"[""[Docs](https://docs.pyth.network/documentation)""]",SDK,TypeScript,"[""Oracle"",""Low-latency""]","First-party financial oracle network delivering low-latency real-world data",Free,,$0,FALSE,FALSE,,TBD,TBD,TBD,TBD
chainlink-sdk,Chainlink,"[""[Docs](https://docs.chain.link/)""]",SDK,Solidity,"[""Oracle"",""Functions""]","Decentralized oracle network providing real-world data to smart contracts",Free,,$0,FALSE,FALSE,,TBD,TBD,TBD,TBD
band-protocol-sdk,Band Protocol,"[""[Docs](https://docs.bandprotocol.com/)""]",SDK,Solidity,"[""Oracle"",""Cross-chain""]","Cross-chain data oracle platform",Free,,$0,FALSE,FALSE,,TBD,TBD,TBD,TBD
api3-sdk,API3,"[""[Docs](https://docs.api3.org/)""]",SDK,Solidity,"[""Oracle"",""dAPI""]","First-party oracles for dApps",Free,,$0,FALSE,FALSE,,TBD,TBD,TBD,TBD
redstone-oracles-sdk,RedStone,"[""[Docs](https://docs.redstone.finance/)""]",SDK,TypeScript,"[""Oracle"",""Storageless""]","Modular oracles delivering data frequently and efficiently",Free,,$0,FALSE,FALSE,,TBD,TBD,TBD,TBD
safe-sdk,Safe (Gnosis),"[""[Docs](https://docs.safe.global/)""]",SDK,TypeScript,"[""Account Abstraction"",""Multisig""]","The standard for smart contract wallets and multisig security",Free,,$0,FALSE,FALSE,,TBD,TBD,TBD,TBD
zerodev-sdk,ZeroDev,"[""[Docs](https://docs.zerodev.app/)""]",SDK,TypeScript,"[""Account Abstraction"",""AA""]","Framework for building AA wallets on top of Safe",Pay-as-you-go,,Custom,FALSE,FALSE,,TBD,TBD,TBD,TBD
pimlico-sdk,Pimlico,"[""[Docs](https://docs.pimlico.io/)""]",SDK,TypeScript,"[""Account Abstraction"",""Bundler""]","Infrastructure for Account Abstraction (ERC-4337)",Pay-as-you-go,,Custom,FALSE,FALSE,,TBD,TBD,TBD,TBD
biconomy-sdk,!provider:biconomy,,,,,,,,,,,,,,,
etherspot-sdk,!provider:etherspot,,,,,,,,,,,,,,,
gelato-sdk,Gelato,"[""[Docs](https://docs.gelato.network/)""]",SDK,TypeScript,"[""Automation"",""Relay""]","Decentralized backend for web3 automation and relaying",Pay-as-you-go,,Custom,FALSE,FALSE,,TBD,TBD,TBD,TBD
stackup-sdk,Stackup,"[""[Docs](https://docs.stackup.sh/)""]",SDK,TypeScript,"[""Account Abstraction"",""Bundler""]","Tools to build custom web3 flows using ERC-4337",Pay-as-you-go,,Custom,FALSE,FALSE,,TBD,TBD,TBD,TBD
openfort-sdk,Openfort,"[""[Docs](https://www.openfort.io/docs) ""]",SDK,TypeScript,"[""Gaming"",""Account Abstraction""]","Wallet-as-a-service for web3 gaming",Pay-as-you-go,,Custom,FALSE,FALSE,,TBD,TBD,TBD,TBD
aarc-sdk,Aarc,"[""[Docs](https://docs.aarc.xyz/)""]",SDK,TypeScript,"[""Account Abstraction"",""DevOps""]","Full-stack AA infrastructure",Pay-as-you-go,,Custom,FALSE,FALSE,,TBD,TBD,TBD,TBD
candide-sdk,Candide,"[""[Docs](https://docs.candide.dev/)""]",SDK,TypeScript,"[""Account Abstraction"",""Mobile""]","Mobile-first smart wallet SDK",Free,,$0,FALSE,FALSE,,TBD,TBD,TBD,TBD
layerzero-sdk,LayerZero,"[""[Docs](https://layerzero.gitbook.io/docs/)""]",SDK,Solidity,"[""Cross-chain"",""Omnichain""]","Omnichain interoperability protocol",Free,,$0,FALSE,FALSE,,TBD,TBD,TBD,TBD
axelar-sdk,Axelar,"[""[Docs](https://docs.axelar.dev/)""]",SDK,Solidity,"[""Cross-chain"",""Interop""]","Secure cross-chain communication for Web3",Free,,$0,FALSE,FALSE,,TBD,TBD,TBD,TBD
wormhole-sdk,Wormhole,"[""[Docs](https://docs.wormhole.com/)""]",SDK,TypeScript,"[""Cross-chain"",""Message""]","Generic message passing protocol for cross-chain apps",Free,,$0,FALSE,FALSE,,TBD,TBD,TBD,TBD
ccip-sdk,Chainlink CCIP,"[""[Docs](https://docs.chain.link/ccip)""]",SDK,Solidity,"[""Cross-chain"",""Interop""]","Cross-Chain Interoperability Protocol by Chainlink",Free,,$0,FALSE,FALSE,,TBD,TBD,TBD,TBD
stargate-sdk,Stargate,"[""[Docs](https://stargateprotocol.gitbook.io/stargate/)""]",SDK,Solidity,"[""Bridge"",""Liquidity""]","Fully composable liquidity transport protocol",Free,,$0,FALSE,FALSE,,TBD,TBD,TBD,TBD
hyperlane-sdk,Hyperlane,"[""[Docs](https://docs.hyperlane.xyz/)""]",SDK,TypeScript,"[""Cross-chain"",""Modular""]","Permissionless interoperability layer",Free,,$0,FALSE,FALSE,,TBD,TBD,TBD,TBD
pancakeswap-sdk,PancakeSwap,"[""[Docs](https://docs.pancakeswap.finance/developers/smart-contracts/pancakeswap-exchange/v3-contracts)""]",SDK,TypeScript,"[""DeFi"",""DEX""]","SDK for interacting with the leading DEX on BSC",Free,,$0,FALSE,FALSE,,TBD,TBD,TBD,TBD
uniswap-sdk,Uniswap,"[""[Docs](https://docs.uniswap.org/sdk/introduction)""]",SDK,TypeScript,"[""DeFi"",""DEX""]","SDK for the Uniswap Protocol",Free,,$0,FALSE,FALSE,,TBD,TBD,TBD,TBD
0x-sdk,0x,"[""[Docs](https://0x.org/docs/)""]",SDK,TypeScript,"[""DeFi"",""Swap""]","API and SDK for decentralized exchange infrastructure",Free,,$0,FALSE,FALSE,,TBD,TBD,TBD,TBD
rubic-sdk,!provider:rubic-sdk,,,,,,,,,,,,,,,
paraswap-sdk,ParaSwap,"[""[Docs](https://developers.paraswap.network/)""]",SDK,TypeScript,"[""DeFi"",""Aggregator""]","SDK for the ParaSwap DEX aggregator",Free,,$0,FALSE,FALSE,,TBD,TBD,TBD,TBD
kyberswap-sdk,KyberSwap,"[""[Docs](https://docs.kyberswap.com/)""]",SDK,TypeScript,"[""DeFi"",""Aggregator""]","DEX aggregator and liquidity protocol SDK",Free,,$0,FALSE,FALSE,,TBD,TBD,TBD,TBD
superfluid-sdk,Superfluid,"[""[Docs](https://docs.superfluid.finance/)""]",SDK,TypeScript,"[""DeFi"",""Streaming""]","Asset streaming protocol for real-time finance",Free,,$0,FALSE,FALSE,,TBD,TBD,TBD,TBD
pendle-sdk,Pendle,"[""[Docs](https://docs.pendle.finance/)""]",SDK,TypeScript,"[""DeFi"",""Yield""]","Protocol for tokenizing and trading future yield",Free,,$0,FALSE,FALSE,,TBD,TBD,TBD,TBD
centrifuge-sdk,Centrifuge,"[""[Docs](https://docs.centrifuge.io/)""]",SDK,TypeScript,"[""RWA"",""Finance""]","Protocol for financing real-world assets on-chain",Free,,$0,FALSE,FALSE,,TBD,TBD,TBD,TBD
goldfinch-sdk,Goldfinch,"[""[Docs](https://docs.goldfinch.finance/)""]",SDK,TypeScript,"[""Credit"",""Lending""]","Decentralized credit protocol",Free,,$0,FALSE,FALSE,,TBD,TBD,TBD,TBD
slither,Slither,"[""[Docs](https://github.com/crytic/slither/wiki)""]",Library,Python,"[""Security"",""Audit""]","Static analysis framework for Solidity",Free,,$0,FALSE,FALSE,,TBD,TBD,TBD,TBD
echidna,Echidna,"[""[Docs](https://github.com/crytic/echidna)""]",Library,Haskell,"[""Security"",""Fuzzing""]","Ethereum smart contract fuzzer",Free,,$0,FALSE,FALSE,,TBD,TBD,TBD,TBD
medusa,Medusa,"[""[Docs](https://github.com/crytic/medusa)""]",Library,Go,"[""Security"",""Fuzzing""]","Parallel coverage-guided fuzzer for smart contracts",Free,,$0,FALSE,FALSE,,TBD,TBD,TBD,TBD
tenderly-sdk,Tenderly,"[""[Docs](https://docs.tenderly.co/)""]",SDK,TypeScript,"[""Simulation"",""DevOps""]","Full-stack infrastructure for Ethereum developers",Pay-as-you-go,,Custom,FALSE,FALSE,,TBD,TBD,TBD,TBD
forta-sdk,Forta,"[""[Docs](https://docs.forta.network/)""]",SDK,TypeScript,"[""Security"",""Monitoring""]","Real-time detection network for security & operational monitoring",Free,,$0,FALSE,FALSE,,TBD,TBD,TBD,TBD
openzeppelin,!provider:openzeppelin,,,,,,,,,,,,,,,
defender-sdk,OpenZeppelin Defender,"[""[Docs](https://docs.openzeppelin.com/defender/)""]",SDK,TypeScript,"[""Security"",""Ops""]","Security operations platform for Ethereum",Pay-as-you-go,,Custom,FALSE,FALSE,,TBD,TBD,TBD,TBD
phalcon-sdk,Phalcon,"[""[Docs](https://docs.phalcon.xyz/)""]",SDK,TypeScript,"[""Security"",""Explorer""]","Transaction explorer and analysis tool",Free,,$0,FALSE,FALSE,,TBD,TBD,TBD,TBD
helio-sdk,Helio,"[""[Docs](https://docs.helio.co/)""]",SDK,TypeScript,"[""Payments"",""Commerce""]","Web3 payments platform",Pay-as-you-go,,Custom,FALSE,FALSE,,TBD,TBD,TBD,TBD
thirdweb-sdk,Thirdweb,"[""[Docs](https://portal.thirdweb.com/)""]",SDK,TypeScript,"[""Development"",""Full-stack""]","Full-stack Web3 development tools",Free,,$0,FALSE,FALSE,,TBD,TBD,TBD,TBD
moralis-streams-sdk,Moralis Streams,"[""[Docs](https://docs.moralis.io/streams-api)""]",SDK,JavaScript,"[""Data"",""Real-time""]","Real-time blockchain data streaming",Pay-as-you-go,,Custom,FALSE,FALSE,,TBD,TBD,TBD,TBD